{
  "$schema": "https://json-schema.org/draft/2020-12/schema",
  "$id": "https://stemmio.local/schemas/change-request.v3.schema.json",
  "title": "Stemmio frozen change request v3",
  "description": "A portable, immutable request that freezes the exact current source snapshot and system-reserved candidate Version identity for one internal-AI attempt.",
  "type": "object",
  "additionalProperties": false,
  "required": [
    "schemaVersion",
    "status",
    "projectId",
    "documentId",
    "requestId",
    "attemptId",
    "createdAt",
    "frozenAt",
    "freezeCutoffRevision",
    "versionIdentity",
    "baseSnapshot",
    "paths",
    "requirements",
    "annotations",
    "finalization"
  ],
  "properties": {
    "schemaVersion": {
      "const": "3.0.0"
    },
    "status": {
      "const": "frozen"
    },
    "projectId": {
      "$ref": "#/$defs/projectId"
    },
    "documentId": {
      "$ref": "#/$defs/documentId"
    },
    "requestId": {
      "$ref": "#/$defs/requestId"
    },
    "attemptId": {
      "$ref": "#/$defs/attemptId"
    },
    "createdAt": {
      "$ref": "#/$defs/timestamp"
    },
    "frozenAt": {
      "$ref": "#/$defs/timestamp"
    },
    "freezeCutoffRevision": {
      "type": "integer",
      "minimum": 0
    },
    "versionIdentity": {
      "$ref": "#/$defs/versionIdentity"
    },
    "baseSnapshot": {
      "$ref": "#/$defs/baseSnapshot"
    },
    "paths": {
      "$ref": "#/$defs/paths"
    },
    "requirements": {
      "$ref": "#/$defs/requirements"
    },
    "annotations": {
      "$ref": "#/$defs/annotations"
    },
    "finalization": {
      "$ref": "#/$defs/finalization"
    }
  },
  "$defs": {
    "versionIdentity": {
      "type": "object",
      "additionalProperties": false,
      "required": [
        "basedOnVersionId",
        "previousVersionId",
        "candidateVersionId",
        "candidateVersionOrdinal",
        "candidateVersionLabel"
      ],
      "properties": {
        "basedOnVersionId": {
          "$ref": "#/$defs/versionId"
        },
        "previousVersionId": {
          "$ref": "#/$defs/versionId"
        },
        "candidateVersionId": {
          "$ref": "#/$defs/versionId"
        },
        "candidateVersionOrdinal": {
          "type": "integer",
          "minimum": 2
        },
        "candidateVersionLabel": {
          "type": "string",
          "pattern": "^V[1-9][0-9]*$"
        }
      }
    },
    "baseSnapshot": {
      "type": "object",
      "additionalProperties": false,
      "required": [
        "relativePath",
        "byteLength",
        "sha256",
        "comparisonSha256",
        "canonicalizationVersion"
      ],
      "properties": {
        "relativePath": {
          "const": "input/base/index.html"
        },
        "byteLength": {
          "type": "integer",
          "minimum": 1
        },
        "sha256": {
          "$ref": "#/$defs/sha256"
        },
        "comparisonSha256": {
          "$ref": "#/$defs/sha256"
        },
        "canonicalizationVersion": {
          "const": "1"
        }
      }
    },
    "paths": {
      "type": "object",
      "additionalProperties": false,
      "required": [
        "requestRelativePath",
        "attemptRelativePath",
        "promptRelativePath",
        "inputManifestRelativePath"
      ],
      "properties": {
        "requestRelativePath": {
          "type": "string",
          "pattern": "^requests/req_[A-Za-z0-9_-]+$"
        },
        "attemptRelativePath": {
          "type": "string",
          "pattern": "^requests/req_[A-Za-z0-9_-]+/attempts/attempt_[0-9]{3}$"
        },
        "promptRelativePath": {
          "type": "string",
          "pattern": "^requests/req_[A-Za-z0-9_-]+/PROMPT\\.md$"
        },
        "inputManifestRelativePath": {
          "type": "string",
          "pattern": "^requests/req_[A-Za-z0-9_-]+/input-manifest\\.json$"
        }
      }
    },
    "requirements": {
      "type": "object",
      "additionalProperties": false,
      "required": [
        "taskSchemaVersion",
        "objective",
        "scopePolicy",
        "instructions",
        "globalAcceptanceCriteria",
        "nonGoals",
        "targets",
        "attachments"
      ],
      "properties": {
        "taskSchemaVersion": {
          "const": "1.0.0"
        },
        "objective": {
          "type": "string",
          "minLength": 1,
          "maxLength": 5000
        },
        "scopePolicy": {
          "enum": [
            "targets-only",
            "targets-plus-required-dependencies",
            "whole-page"
          ]
        },
        "instructions": {
          "type": "array",
          "minItems": 1,
          "items": {
            "type": "object",
            "additionalProperties": false,
            "required": [
              "instructionId",
              "priority",
              "text",
              "targetRefs",
              "acceptanceCriteria"
            ],
            "properties": {
              "instructionId": {
                "type": "string",
                "pattern": "^instruction_[A-Za-z0-9_-]+$"
              },
              "priority": {
                "const": "required"
              },
              "text": {
                "type": "string",
                "minLength": 1,
                "maxLength": 20000
              },
              "targetRefs": {
                "type": "array",
                "minItems": 1,
                "uniqueItems": true,
                "items": {
                  "type": "string",
                  "pattern": "^target_[A-Za-z0-9_-]+$"
                }
              },
              "acceptanceCriteria": {
                "type": "array",
                "maxItems": 50,
                "uniqueItems": true,
                "items": {
                  "type": "string",
                  "minLength": 1,
                  "maxLength": 20000
                }
              },
              "attachmentRefs": {
                "type": "array",
                "uniqueItems": true,
                "items": {
                  "type": "string",
                  "pattern": "^attachment_[A-Za-z0-9_-]+$"
                }
              }
            }
          }
        },
        "globalAcceptanceCriteria": {
          "type": "array",
          "maxItems": 50,
          "uniqueItems": true,
          "items": {
            "type": "string",
            "minLength": 1,
            "maxLength": 20000
          }
        },
        "nonGoals": {
          "type": "array",
          "maxItems": 50,
          "uniqueItems": true,
          "items": {
            "type": "string",
            "minLength": 1,
            "maxLength": 20000
          }
        },
        "attachments": {
          "type": "array",
          "items": {
            "$ref": "#/$defs/attachment"
          }
        },
        "targets": {
          "type": "array",
          "minItems": 1,
          "items": {
            "$ref": "#/$defs/target"
          }
        }
      }
    },
    "target": {
      "type": "object",
      "additionalProperties": false,
      "required": [
        "targetId",
        "label",
        "level",
        "resolution"
      ],
      "properties": {
        "targetId": {
          "type": "string",
          "pattern": "^target_[A-Za-z0-9_-]+$"
        },
        "elementId": {
          "type": "string",
          "pattern": "^sm1_[0-9a-f]{12}4[0-9a-f]{3}[89ab][0-9a-f]{15}$"
        },
        "expectedSourceSha256": {
          "$ref": "#/$defs/sha256"
        },
        "label": {
          "type": "string",
          "minLength": 1,
          "maxLength": 500
        },
        "level": {
          "enum": [
            "module",
            "subregion",
            "text",
            "insertion-point"
          ]
        },
        "selector": {
          "type": "string",
          "minLength": 1,
          "maxLength": 4000
        },
        "textQuote": {
          "type": "string",
          "maxLength": 5000
        },
        "textLocator": {
          "$ref": "#/$defs/textLocator"
        },
        "sourceAnchor": {
          "$ref": "#/$defs/sourceAnchor"
        },
        "fingerprint": {
          "$ref": "#/$defs/fingerprint"
        },
        "resolution": {
          "enum": [
            "exact",
            "rebound",
            "ambiguous",
            "orphaned"
          ]
        }
      },
      "anyOf": [
        {
          "required": [
            "elementId"
          ]
        },
        {
          "required": [
            "selector"
          ]
        },
        {
          "required": [
            "sourceAnchor"
          ]
        },
        {
          "required": [
            "fingerprint"
          ]
        }
      ],
      "allOf": [
        {
          "if": {
            "required": [
              "elementId"
            ]
          },
          "then": {
            "required": [
              "expectedSourceSha256",
              "fingerprint"
            ]
          }
        }
      ]
    },
    "textLocator": {
      "type": "object",
      "additionalProperties": false,
      "required": [
        "quote",
        "startOffset",
        "endOffset",
        "affinity"
      ],
      "properties": {
        "quote": {
          "type": "string",
          "minLength": 1,
          "maxLength": 5000
        },
        "startOffset": {
          "type": "integer",
          "minimum": 0
        },
        "endOffset": {
          "type": "integer",
          "minimum": 1
        },
        "affinity": {
          "enum": [
            "forward",
            "backward"
          ]
        }
      }
    },
    "attachment": {
      "type": "object",
      "additionalProperties": false,
      "required": [
        "attachmentId",
        "commentId",
        "targetRef",
        "kind",
        "fileName",
        "mediaType",
        "byteLength",
        "sha256",
        "relativePath",
        "requestRelativePath"
      ],
      "properties": {
        "attachmentId": {
          "type": "string",
          "pattern": "^attachment_[A-Za-z0-9_-]+$"
        },
        "commentId": {
          "type": "string",
          "pattern": "^comment_[A-Za-z0-9_-]+$"
        },
        "targetRef": {
          "type": "string",
          "pattern": "^target_[A-Za-z0-9_-]+$"
        },
        "kind": {
          "enum": [
            "image",
            "file"
          ]
        },
        "fileName": {
          "type": "string",
          "minLength": 1,
          "maxLength": 255
        },
        "mediaType": {
          "type": "string",
          "minLength": 1,
          "maxLength": 200
        },
        "byteLength": {
          "type": "integer",
          "minimum": 1,
          "maximum": 26214400
        },
        "sha256": {
          "$ref": "#/$defs/sha256"
        },
        "relativePath": {
          "$ref": "#/$defs/relativePath"
        },
        "requestRelativePath": {
          "$ref": "#/$defs/relativePath"
        },
        "localPath": {
          "type": "string",
          "minLength": 1,
          "maxLength": 4096,
          "pattern": "^/[^\\u0000\\r\\n]+$"
        },
        "source": {
          "enum": [
            "clipboard",
            "file-picker"
          ]
        }
      }
    },
    "sourceAnchor": {
      "type": "object",
      "additionalProperties": false,
      "required": [
        "startOffset",
        "endOffset",
        "sourceSha256"
      ],
      "properties": {
        "startOffset": {
          "type": "integer",
          "minimum": 0
        },
        "endOffset": {
          "type": "integer",
          "minimum": 0
        },
        "sourceSha256": {
          "$ref": "#/$defs/sha256"
        }
      }
    },
    "fingerprint": {
      "type": "object",
      "additionalProperties": false,
      "required": [
        "tagName",
        "stableAttributes",
        "ancestorFingerprint"
      ],
      "properties": {
        "tagName": {
          "type": "string",
          "pattern": "^[a-z][a-z0-9:-]*$"
        },
        "stableAttributes": {
          "type": "object",
          "maxProperties": 32,
          "additionalProperties": {
            "type": "string",
            "maxLength": 4000
          }
        },
        "ancestorFingerprint": {
          "type": "array",
          "maxItems": 32,
          "items": {
            "type": "string",
            "maxLength": 4000
          }
        },
        "textPrefix": {
          "type": "string",
          "maxLength": 500
        },
        "textSuffix": {
          "type": "string",
          "maxLength": 500
        }
      }
    },
    "annotations": {
      "type": "object",
      "additionalProperties": false,
      "required": [
        "relativePath",
        "sha256",
        "commentCount",
        "editEventCount"
      ],
      "properties": {
        "relativePath": {
          "const": "input/annotations/records.json"
        },
        "sha256": {
          "$ref": "#/$defs/sha256"
        },
        "commentCount": {
          "type": "integer",
          "minimum": 0
        },
        "editEventCount": {
          "type": "integer",
          "minimum": 0
        },
        "attachmentCount": {
          "type": "integer",
          "minimum": 0
        }
      }
    },
    "finalization": {
      "type": "object",
      "additionalProperties": false,
      "required": [
        "outputRelativePath",
        "completionRelativePath",
        "completionSchema",
        "supportedFinalizerVersion",
        "finalizerCommand"
      ],
      "properties": {
        "outputRelativePath": {
          "type": "string",
          "pattern": "^output/(?:V1\\.[0-9]+|[^/\\\\]+-V1\\.[0-9]+)\\.html$",
          "description": "Stemmio-generated original-name plus semantic Version output path."
        },
        "completionRelativePath": {
          "const": "completion.json"
        },
        "completionSchema": {
          "const": "completion.v1.schema.json"
        },
        "supportedFinalizerVersion": {
          "const": "1.0.0"
        },
        "finalizerCommand": {
          "type": "string",
          "minLength": 1,
          "maxLength": 8192
        }
      }
    },
    "projectId": {
      "type": "string",
      "pattern": "^project_[A-Za-z0-9_-]+$"
    },
    "documentId": {
      "type": "string",
      "pattern": "^doc_[A-Za-z0-9_-]+$"
    },
    "requestId": {
      "type": "string",
      "pattern": "^req_[A-Za-z0-9_-]+$"
    },
    "attemptId": {
      "type": "string",
      "pattern": "^attempt_[0-9]{3}$"
    },
    "versionId": {
      "type": "string",
      "pattern": "^ver_[0-9]{4,}$"
    },
    "relativePath": {
      "type": "string",
      "minLength": 1,
      "maxLength": 4096,
      "pattern": "^(?!/)(?![A-Za-z]:)(?!.*\\\\)(?!.*//)(?!\\.\\.?$)(?!\\.\\.?/)(?!.*\\/\\.\\.?\\/)(?!.*\\/\\.\\.?$)[^\\u0000\\r\\n]+$"
    },
    "timestamp": {
      "type": "string",
      "format": "date-time"
    },
    "sha256": {
      "type": "string",
      "pattern": "^sha256:[a-f0-9]{64}$"
    }
  }
}
